{
  "$schema": "https://json-schema.org/draft/2020-12/schema",
  "$id": "https://agentstatus.dev/schemas/toa/0.1.json",
  "title": "Tool Outcome Attestation",
  "description": "Signed evidence that an MCP tool probe produced graded layer outcomes (toa/0.1). Not a wire protocol.",
  "type": "object",
  "required": [
    "spec",
    "toa_id",
    "tool",
    "run",
    "observed_at",
    "layers",
    "emitter"
  ],
  "properties": {
    "spec": { "const": "toa/0.1" },
    "toa_id": {
      "type": "string",
      "pattern": "^toa_[a-f0-9]{20}$"
    },
    "tool": {
      "type": "object",
      "required": ["name", "server_id"],
      "properties": {
        "name": { "type": "string", "minLength": 1 },
        "server_id": { "type": "string", "minLength": 1 },
        "catalog_hash": { "type": ["string", "null"] }
      }
    },
    "run": {
      "type": "object",
      "required": ["decision_id", "agent_id"],
      "properties": {
        "decision_id": { "type": "string" },
        "agent_id": { "type": "string" }
      }
    },
    "observed_at": {
      "type": "string",
      "format": "date-time",
      "pattern": "^[0-9]{4}-[0-9]{2}-[0-9]{2}T[0-9]{2}:[0-9]{2}:[0-9]{2}(?:\\.[0-9]+)?(Z|[+-][0-9]{2}:[0-9]{2})$",
      "description": "RFC 3339 timestamp. Timezone offset (Z or ±HH:MM) is required. Naive local timestamps are invalid."
    },
    "layers": {
      "type": "object",
      "required": [
        "reach",
        "invoke",
        "functional",
        "shape",
        "openapi_fidelity",
        "compositional"
      ],
      "properties": {
        "reach": { "enum": ["pass", "fail", "n/a"] },
        "invoke": { "enum": ["pass", "fail", "n/a"] },
        "functional": { "enum": ["pass", "fail", "n/a"] },
        "shape": { "enum": ["pass", "fail", "warn", "n/a"] },
        "openapi_fidelity": { "enum": ["pass", "fail", "warn", "n/a"] },
        "compositional": { "enum": ["pass", "fail", "n/a"] }
      }
    },
    "outcome_grade": {
      "type": ["string", "null"],
      "description": "operator | schema | substance | soft | none | …"
    },
    "disposition": {
      "type": "string",
      "enum": ["delivered", "failed", "refused", "unavailable"],
      "description": "Optional signed delivery disposition. Prefer explicit values on negative paths (MCP extension absence gap)."
    },
    "args_hash": {
      "type": "string",
      "pattern": "^sha256:[a-f0-9]{64}$",
      "description": "Optional signed commitment to tool arguments (RFC 8785 JCS SHA-256). When present, verifiers MUST check it; when absent, requiring it is a verifier policy decision."
    },
    "business_outcome_ok": { "type": ["boolean", "null"] },
    "reasons": {
      "type": "array",
      "items": { "type": "string" },
      "maxItems": 12
    },
    "emitter": {
      "type": "object",
      "required": ["name", "version", "key_id"],
      "properties": {
        "name": {
          "type": "string",
          "minLength": 1,
          "description": "Who graded and signed. AgentStatus uses \"agentstatus\"."
        },
        "version": { "type": "string" },
        "key_id": { "type": "string" }
      }
    },
    "payload_hash": {
      "type": "string",
      "pattern": "^sha256:[a-f0-9]{64}$"
    },
    "signature": {
      "type": ["string", "null"],
      "description": "Base64 signature over canonical JSON of signed claim fields (algorithm selected by envelope alg)"
    },
    "public_key_id": { "type": "string" },
    "alg": {
      "type": "string",
      "description": "Envelope signing algorithm. Absent means Ed25519 for toa/0.1 backward compatibility. Only Ed25519 is required to be implemented today; unknown values MUST fail closed."
    }
  }
}
