{
  "spec": "toa/0.1",
  "toa_id": "toa_0123456789abcdef0123",
  "tool": {
    "name": "get_weather",
    "server_id": "00000000-0000-0000-0000-000000000000",
    "catalog_hash": null
  },
  "run": {
    "decision_id": "example-decision",
    "agent_id": "00000000-0000-0000-0000-000000000000"
  },
  "observed_at": "2026-08-29T12:00:00Z",
  "layers": {
    "reach": "pass",
    "invoke": "pass",
    "functional": "pass",
    "shape": "n/a",
    "openapi_fidelity": "n/a",
    "compositional": "n/a"
  },
  "outcome_grade": "substance",
  "business_outcome_ok": false,
  "reasons": ["example:unsigned document for schema illustration only"],
  "emitter": {
    "name": "agentstatus",
    "version": "0.1.0",
    "key_id": "v1"
  },
  "signature": null,
  "public_key_id": "v1"
}
