{
  "spec": "toa/0.1",
  "toa_id": "toa_c3d4e5f60718293a1b2c",
  "tool": {
    "name": "echo",
    "server_id": "conformance-echo-server",
    "catalog_hash": null
  },
  "run": {
    "decision_id": "conformance-293a1b2c",
    "agent_id": "00000000-0000-0000-0000-0000000000c0"
  },
  "observed_at": "2020-01-01T00:00:00Z",
  "layers": {
    "reach": "pass",
    "invoke": "pass",
    "functional": "pass",
    "shape": "n/a",
    "openapi_fidelity": "n/a",
    "compositional": "n/a"
  },
  "outcome_grade": "substance",
  "business_outcome_ok": true,
  "reasons": [
    "conformance:expired golden"
  ],
  "emitter": {
    "name": "toa-conformance",
    "version": "0.1.0",
    "key_id": "test-v1"
  },
  "payload_hash": "sha256:9f31dc3181cd8fb3dc7fa1d5f4ea0ce96903f1cc074366bfebc5b57f9af8fcbd",
  "signature": "mzICyJ+zF3Zfkgz665DB0K8FitLMp/VEutcl3lsTGXQhgfnI4cRVVGEGIoVfn1pGiVsVpFt3jKiFpvpWbswYCA==",
  "public_key_id": "test-v1"
}
